iso3,uid,country,plant_type,gcd_plant_name,gcd_company_name,gcd_location,status,latitude,longitude,source,accuracy,permid,company_name,reported_capacity,reported_online_modernisation,owner_source,date_accessed,parent_permid,parent_name,desc,num_kilns_1,kiln_type_1,num_kilns_2,kiln_type_2,capacity,capacity_unit,contact,tel,fax
CHN,CHN0513,China,Integrated,,Nanjing Jinjiang Cement Plant,"Jiangning, Jiangning, Nanjing, Jiangsu",Operating,31.9385415,118.8939437,GCD,Approximate,,,,,,,,,1 Dry - 0.47Mt/yr,1.0,DRY,,,0.47,Mt/yr,,+86-25-58602681,+86-25-58602648
CHN,CHN0514,China,Integrated,,Nanning Jingang Cement,"No.98 Bailing Road, Liangqing, Nanning, Guangxi",Operating,22.753846,108.41273600000001,GCD,Approximate,,,,,,,,,2 Shaft - 0.20Mt/yr,,,,,0.2,Mt/yr,,+86-771-4911610,+86-771-4916990
CHN,CHN0515,China,Integrated,,Nanning Zhengda Building Materials,"Wuyu, Jiangnan, Nanning, Guangxi",Operating,22.59159575,108.1339138,GCD,Approximate,,,,,,,,,1 Dry - 0.47Mt/yr,1.0,DRY,,,0.47,Mt/yr,,+86-771-4206266,+86-771-4207582
CHN,CHN0519,China,Integrated,,Ningxia Building Materials (Sinoma),"Haodian Street, Liupanshan, Jingyuan, Guyuan, Ningxia",Operating,35.7071501,106.2884408,GCD,Approximate,,,,,,,,,1 Dry - 0.31Mt/yr,1.0,DRY,,,0.31,Mt/yr,,+86-954-2860120,+86-954-2861045
CHN,CHN0525,China,Integrated,,Ningxia Helan Jinshan Cement,"Hongguang, Helan, Yinchuan, Ningxia",Operating,38.738715,106.27833700000001,GCD,Approximate,,,,,,,,,1 Shaft - 0.10Mt/yr,,,,,0.1,Mt/yr,,+86-951-8991113,+86-951-8991034
CHN,CHN0526,China,Integrated,,Ningxia Huatai New Cement Group,"Zhenluo, Zhongwei, Yinchuan, Ningxia",Operating,38.4829193999999,106.21160139999901,GCD,Approximate,,,,,,,,,4 Shaft - 0.20Mt/yr,,,,,0.2,Mt/yr,,+86-955-7619799,+86-955-7618018
CHN,CHN0527,China,Integrated,,Ningxia Jiancheng Building Materials,"Wangyuan Economic Development Zone, Yongning, Yinchuan, Ningxia",Operating,38.2792422,106.2495805,GCD,Approximate,,,,,,,,,1 Dry - 0.47Mt/yr,1.0,DRY,,,0.47,Mt/yr,,+86-951-8463078,+86-951-8463028
CHN,CHN0529,China,Integrated,,Ningxia Shengjin Cement,"Shengjin, Zhenluo, Zhongwei, Wuzhong, Ningxia",Operating,37.9822616,106.19611090000002,GCD,Approximate,,,,,,,,,1 Dry - 0.78Mt/yr,1.0,DRY,,,0.78,Mt/yr,,+86-955-7612885,+86-955-7612885
CHN,CHN0531,China,Integrated,,Ningxia Wuzhong Cement Industrial,"Houjiawan, Wuzhong, Ningxia",Operating,37.9822616,106.19611090000002,GCD,Approximate,,,,,,,,,2 Shaft - 0.13Mt/yr,,,,,0.13,Mt/yr,,+86-953-2661471,+86-953-2661001
CHN,CHN0532,China,Integrated,,Ningxia Xixia Cement,"Aishan Street, Dana, Qintongxia, Ningxia",Operating,37.0000001,105.9999999,GCD,Approximate,,,,,,,,,5 Dry - 0.70Mt/yr,5.0,DRY,,,0.7,Mt/yr,,+86-953-3041312,+86-953-3041312
CHN,CHN0533,China,Integrated,,Ningxia Yinghai Lingwu Special Cement,"Dongta, Lingwu, Yinchuan, Ningxia",Operating,38.0937225,106.33199520000001,GCD,Approximate,,,,,,,,,1 Dry - 0.31Mt/yr,1.0,DRY,,,0.31,Mt/yr,,+86-951-4510434,+86-951-4510204
CHN,CHN0534,China,Integrated,,Ningxia Yinghai Yinchuan Building Materials,"Wenchang South Road, Xixia, Yinchuan, Ningxia",Operating,38.50908535,106.0130513,GCD,Approximate,,,,,,,,,1 Dry - 0.31Mt/yr,1.0,DRY,,,0.31,Mt/yr,,+86-951-2038604,+86-951-2020234
CHN,CHN0535,China,Integrated,,Ningyuan Lianhuatang Cement,"Lianhuatang, Shunling, Ningyuan, Yongzhou, Hunan",Operating,25.590422,111.95233300000001,GCD,Approximate,,,,,,,,,2 Dry - 1Mt/yr,2.0,DRY,,,1.0,Mt/yr,,+86-746-7228628,+86-746-7228556
CHN,CHN0536,China,Integrated,Panjing Cement,Pangu Cement Group,"He, Chaohu, Anhui",Operating,31.6684461999999,117.66980890000002,GCD,Approximate,,,,,,,,,2 Dry - 2.81Mt/yr,2.0,DRY,,,2.81,Mt/yr,,+86-565-5131678,+86-565-5131678
CHN,CHN0538,China,Integrated,,Panzhihua Hongguo Cement,"Hongguo, Hongni, Yanbian, Panzhihua, Sichuan",Operating,26.8815166,101.6180743,GCD,Approximate,,,,,,,,,2 Shaft - 0.20Mt/yr,,,,,0.2,Mt/yr,,+86-812-8729075,+86-812-8729073
CHN,CHN0539,China,Integrated,,ingdingshan Xingfeng Group,"Xinhua, Pingdingshan, Henan",Operating,33.7705881,113.17559879999901,GCD,Approximate,,,,,,,,,3 Dry - 2.50Mt/yr,3.0,DRY,,,2.5,Mt/yr,,+86-375--2039000,+86-375--20399988
CHN,CHN0540,China,Integrated,,Pingli Kanghua Building Materials,"Laoxian, Pingli, Ankang, Shaanxi",Operating,32.54571,109.1436449,GCD,Approximate,,,,,,,,,5 Shaft - 0.30Mt/yr,,,,,0.3,Mt/yr,,+86-915-8562060,+86-915-8562060
CHN,CHN0541,China,Integrated,,Pingnan Yanfeng Cement,"Luohe, Pingnan, Pingnan, Guigang, Guangxi",Operating,23.5469315,110.3921104,GCD,Approximate,,,,,,,,,2 Shaft - 0.20Mt/yr,,,,,0.2,Mt/yr,,+86-775-7814057,+86-775-7814488
CHN,CHN0543,China,Integrated,,Pingshan Jinsha Cement,"Jinsha, Pingshan, Yibin, Sichuan",Operating,28.6683652,103.8577714,GCD,Approximate,,,,,,,,,2 Shaft - 0.20Mt/yr,,,,,0.2,Mt/yr,,+86-831-5759977,+86-831-5759977
CHN,CHN0544,China,Integrated,,Pishan Duwa Yushan Cement,"Duwa, Pishan, Hetian, Xinjiang",Operating,37.6181668,78.2791975999999,GCD,Approximate,,,,,,,,,2 Shaft - 0.15Mt/yr,,,,,0.15,Mt/yr,,+86-993-6488548,+86-993-6488548
CHN,CHN0546,China,Integrated,,Prosperity Minerals Holdings Limited Hong Kong,"Matian, Chengguan, Pingba, Anshun, Guizhou",Operating,26.4466979,106.1806779,GCD,Approximate,,,,,,,,,2 Dry - 2.5Mt/yr,2.0,DRY,,,2.5,Mt/yr,,+86-853-4225608,+86-853-4226208
CHN,CHN0548,China,Integrated,Cement,Prosperity Minerals Holdings Limited Hong Kong,"Tangba, Hechuan, Chongqing",Operating,29.9969267999999,106.2605768,GCD,Approximate,,,,,,,,,1 Dry - 1.44Mt/yr,1.0,DRY,,,1.44,Mt/yr,,Chongqing Prosperity +86-23-42757722,+86-23-42757738
CHN,CHN0549,China,Integrated,,Pubei Lubaoshi Cement,"Zhaiyu, Pubei, Qinzhou, Guangxi",Operating,22.2725061,109.51385400000001,GCD,Approximate,,,,,,,,,3 Shaft - 0.30Mt/yr,,,,,0.3,Mt/yr,,+86-777-8768088,+86-777-8768998
CHN,CHN0550,China,Integrated,,Pucheng Dakongxiang Pubei Cement,"Riguang, Dakong, Pucheng, Weinan, Shaanxi",Operating,34.9588442999999,109.593807199999,GCD,Approximate,,,,,,,,,1 Shaft - 0.10Mt/yr,,,,,0.1,Mt/yr,,+86-913-7378128,+86-913-7378128
CHN,CHN0551,China,Integrated,,Pucheng Jielin Cement,"Sunzhen Pucheng, Weinan, Shaanxi",Operating,34.9825052999999,109.75513670000001,GCD,Approximate,,,,,,,,,1 Shaft - 0.10Mt/yr,,,,,0.1,Mt/yr,,+86-913-7888126,+86-913-7889199
CHN,CHN0552,China,Integrated,,Pucheng Qianxing Cement,"Riguang, Dakong, Pucheng, Weinan, Shaanxi",Operating,34.9588442999999,109.593807199999,GCD,Approximate,,,,,,,,,1 Shaft - 0.08Mt/yr,,,,,0.08,Mt/yr,,+86-913-7378369,+86-913-7378369
CHN,CHN0553,China,Integrated,,Pucheng Yongfeng Cement,"Shima, Yongfeng, Pucheng, Weinan, Shaanxi",Operating,34.9588442999999,109.593807199999,GCD,Approximate,,,,,,,,,1 Dry - 0.31Mt/yr,1.0,DRY,,,0.31,Mt/yr,,+86-913-7712098,+86-913-7715083
CHN,CHN0554,China,Integrated,,Qianyang Qianling Cement,"No.1 Guishankou, Qianqiao South, Qianyang, Baoji, Shaanxi",Operating,34.6461352,107.1214915,GCD,Approximate,,,,,,,,,1 Shaft - 0.12Mt/yr,,,,,0.12,Mt/yr,,+86-917-4241191,+86-917-4218808
CHN,CHN0555,China,Integrated,,Qianyang Xueshan Cement,"Yuhua, Shuigou, Qianyang, Baoji, Shaanxi",Operating,34.7496299999999,107.01394099999901,GCD,Approximate,,,,,,,,,1 Shaft - 0.10Mt/yr,,,,,0.1,Mt/yr,,+86-917-4256005,+86-917-4256005
CHN,CHN0557,China,Integrated,,Qinghai Datong Cement,"No.98 Ningzhang Road, Datong, Xining, Qinghai",Operating,37.073318,101.5720801,GCD,Approximate,,,,,,,,,2 Shaft - 0.12Mt/yr,,,,,0.12,Mt/yr,,+86-971-2722630,+86-971-2721047
CHN,CHN0558,China,Integrated,,Qinghai Datong Yuanshuo Cement,"Maojiazhai, Yuanshuo, Datong, Xining, Qinghai",Operating,37.073318,101.5720801,GCD,Approximate,,,,,,,,,4 Shaft - 0.20Mt/yr,,,,,0.2,Mt/yr,,+86-971-2887046,+86-971-2887046
CHN,CHN0559,China,Integrated,,Qinghai Haixi Chemical Building Materials,"No.13 Yingbin Road, East Delingha, Qinghai",Operating,37.8916442,96.76825387,GCD,Approximate,,,,,,,,,2 Dry - 0.40Mt/yr,2.0,DRY,,,0.4,Mt/yr,,+86-977-8202228,+86-977-8201748
CHN,CHN0560,China,Integrated,,Qinghai Ledu Huaxia Cement,"Wanshi, Gaodian, Lede, Haidong, Qinghai",Operating,36.3098977999999,102.356454,GCD,Approximate,,,,,,,,,7 Shaft - 0.45Mt/yr,,,,,0.45,Mt/yr,,+86-972-8653140,+86-972-8653140
CHN,CHN0561,China,Integrated,,Qinghai New Building Industrial and Trading,"No.88 Liming Road, Yuanshuo, Datong, Xining, Qinghai",Operating,37.073318,101.5720801,GCD,Approximate,,,,,,,,,1 Dry - 0.62Mt/yr,1.0,DRY,,,0.62,Mt/yr,,+86-971-2761633,+86-971-2761768
CHN,CHN0562,China,Integrated,,Qinghai Taining Cement,"Daxia, Yurun, Ledu, Haidong, Qinghai",Operating,36.48232700000001,102.4012523,GCD,Approximate,,,,,,,,,4 Shaft - 0.20Mt/yr,,,,,0.2,Mt/yr,,+86-972-8657246,+86-972-8657859
CHN,CHN0564,China,Integrated,,Qujing Cement,"Zhangjiaying, Sanbao, Qilin, Qujing, Yunnan",Operating,25.4226,103.82700000000001,GCD,Approximate,,,,,,,,,1 Shaft - 0.12Mt/yr,,,,,0.12,Mt/yr,,+86-874-3983066,+86-874-3983067
CHN,CHN0565,China,Integrated,,Qushui Xintong Cement,"Apusa Induareial Park, Qushui County, Lhasa, Tibet",Operating,29.453991100000003,90.7249729999999,GCD,Approximate,,,,,,,,,2 Shaft - 0.13Mt/yr,,,,,0.13,Mt/yr,,+86-891-6167306,+86-891-6167127
CHN,CHN0566,China,Integrated,,Rongshui Beijiang Cement,"Xikuoling, Rongshui, Rongshui, Liuzhou, Guangxi",Operating,25.071872,109.249897099999,GCD,Approximate,,,,,,,,,1 Dry - 0.31Mt/yr,1.0,DRY,,,0.31,Mt/yr,,+86-772-5125689,+86-772-5125290
CHN,CHN0568,China,Integrated,,SCITUS Cement China Holdings,"No.136 Heping Road, Yongning New, Luzhou, Sichuan",Operating,28.78547045,105.37840290000001,GCD,Approximate,,,,,,,,,1 Dry - 1.44Mt/yr,1.0,DRY,,,1.44,Mt/yr,,+86-830-6254746,+86-830-6254746
CHN,CHN0571,China,Integrated,,SCITUS Cement China Holdings,"Xiaba, Yachi, Bijie, Guizhou",Operating,27.3001269,105.3023495,GCD,Approximate,,,,,,,,,1 Dry - 0.78Mt/yr,1.0,DRY,,,0.78,Mt/yr,,+86-857-8543892,+86-857-8543892
CHN,CHN0572,China,Integrated,Huaining Shangfeng Cement,Sahngfeng Cement Group,"Yueshan, Huaining, Anqing, Anhui",Operating,30.7327026,116.82731319999901,GCD,Approximate,,,,,,,,,1 Dry - 1.4Mt/yr,1.0,DRY,,,1.4,Mt/yr,,+86-556-4067709,+86-556-4067709
CHN,CHN0573,China,Integrated,,San Teh Quanzhou San Teh Building Materials,"Chengnan Development Zone, Huian, Quanzhou, Fujian",Operating,24.9997352,118.78935770000001,GCD,Approximate,,,,,,,,,1 Dry - 0.31Mt/yr,1.0,DRY,,,0.31,Mt/yr,,+86-595-87330098,+86-595-87337099
CHN,CHN0575,China,Integrated,,Santeh Cement China,"Xintun, Heqing, Dali, Yunnan",Operating,26.651202,100.212351,GCD,Approximate,,,,,,,,,2 Dry - 1.56Mt/yr,2.0,DRY,,,1.56,Mt/yr,,+86-872-4342828,+86-872-4342869
CHN,CHN0576,China,Integrated,,Santeh Cement China Holdings,"Hexikou, Dongbang, Xinluo, Longyan, Fujian",Operating,25.1866454,117.03741240000001,GCD,Approximate,,,,,,,,,1 Dry - 0.62Mt/yr,1.0,DRY,,,0.62,Mt/yr,,+86-597-2771670,+86-597-2771670
CHN,CHN0579,China,Integrated,Tongchuan Huashan Cement,Shaanxi Coal Construction,"Wangjiabian, Dongjiahe, Yaozhou, Tongchuan, Shaanxi",Operating,34.961637700000004,108.9952348,GCD,Approximate,,,,,,,,,1 Dry - 0.37Mt/yr,1.0,DRY,,,0.37,Mt/yr,,+86-919-7189275,+86-919-7189276
CHN,CHN0580,China,Integrated,,Shaanxi Fengxiang Yongchuan Cement,"Xibai, Miganqiao, Fengxiang, Baoji, Shaanxi",Operating,34.5215207,107.3962875,GCD,Approximate,,,,,,,,,1 Shaft - 0.10Mt/yr,,,,,0.1,Mt/yr,,+86-917-7743135,+86-917-7743135
CHN,CHN0581,China,Integrated,,Shaanxi Longzhou Cement,"Shenquan, Chengguan, Longxian, Baoji, Shaanxi",Operating,34.8721,106.846415099999,GCD,Approximate,,,,,,,,,2 Shaft - 0.16Mt/yr,,,,,0.16,Mt/yr,,+86-917-4655945,+86-917-4655266
CHN,CHN0583,China,Integrated,,Shaanxi Mianxian Dingjunshan Building Materials,"Jinquan, Mianxian Hanzhong, Shaanxi",Operating,36.0,109.0,GCD,Approximate,,,,,,,,,2 Shaft - 0.20Mt/yr,,,,,0.2,Mt/yr,,+86-916-3439247,+86-916-3439247
CHN,CHN0584,China,Integrated,,Shaanxi Pucheng Chenglong Cement,"Sunzhen Pucheng, Weinan, Shaanxi",Operating,34.9825052999999,109.75513670000001,GCD,Approximate,,,,,,,,,1 Shaft - 0.10Mt/yr,,,,,0.1,Mt/yr,,+86-913-7888238,+86-913-7888288
CHN,CHN0585,China,Integrated,,Shaanxi Sanxing Building Materials,"Laozhuang, Chenggu, Hanzhong, Shaanxi",Operating,33.1551002,107.29686170000001,GCD,Approximate,,,,,,,,,1 Shaft - 0.10Mt/yr,,,,,0.1,Mt/yr,,+86-916-7341598,+86-916-7341588
CHN,CHN0587,China,Integrated,,Shaanxi Tianzhu Cement Manufacture,"Hejiadao, Fengming, Qishan, Baoji, Shaanxi",Operating,34.4450251,107.62243590000001,GCD,Approximate,,,,,,,,,4 Dry - 0.50Mt/yr,4.0,DRY,,,0.5,Mt/yr,,+86-917-8215678,+86-917-8212295
CHN,CHN0588,China,Integrated,,Shaanxi Tongchuan Shengwei Building Materials,"Lijiagou, Huangpu, Tongchuan, Shaanxi",Operating,35.19601765,109.00472260000001,GCD,Approximate,,,,,,,,,2 Dry - 3.12Mt/yr,2.0,DRY,,,3.12,Mt/yr,,+86-919-7161911,+86-919-7161911
CHN,CHN0590,China,Integrated,,Shaanxi Yaozhou Cement,"Wenchang, Sunyuan, Yaozhou, Tongchuan, Shaanxi",Operating,34.934437,109.02506000000001,GCD,Approximate,,,,,,,,,1 Dry - 0.47Mt/yr,1.0,DRY,,,0.47,Mt/yr,,+86-919-6281116,+86-919-6281755
CHN,CHN0591,China,Integrated,,Shandan Cement Group,"Jiaotong Street, Shandan, Zhangye, Gansu",Operating,38.530857,101.226025,GCD,Approximate,,,,,,,,,2 Dry - 0.60Mt/yr,2.0,DRY,,,0.6,Mt/yr,,+86-936-2723156,+86-936-2723156
CHN,CHN0592,China,Integrated,,Shandan Qingquan Cement,"No.47 Donghuan Road, Shandan, Zhangye, Gansu",Operating,38.530857,101.226025,GCD,Approximate,,,,,,,,,2 Shaft - 0.12Mt/yr,,,,,0.12,Mt/yr,,+86-936-2721143,+86-936-2721105
CHN,CHN0594,China,Integrated,,Shandong Cement (Votorantim),"No.300 Zhongxing Road, Yicheng, Zaozhuang, Shandong",Operating,34.71245715,117.5497501,GCD,Approximate,,,,,,,,,2 Dry - 1.56Mt/yr,2.0,DRY,,,1.56,Mt/yr,,+86-519-87399919,+86-519-87399919
CHN,CHN0595,China,Integrated,,Shandong Chongzheng Cement Group,"Hong’e Road, Honhshan, Zichuan, Zibo, Shandong",Operating,36.56274035,118.04208670000001,GCD,Approximate,,,,,,,,,4 Dry - 3Mt/yr,4.0,DRY,,,3.0,Mt/yr,,+86-533-5819957,+86-533-5819359
CHN,CHN0596,China,Integrated,Cement,Shandong Jinlucheng Group,"Babaoshan, Qufu, Jining, Shandong",Operating,35.5956915,116.98754299999901,GCD,Approximate,,,,,,,,,2 Dry - 1.56Mt/yr,2.0,DRY,,,1.56,Mt/yr,,Shandong Jinlucheng +86-537-4612177,+86-537-4611600
CHN,CHN0597,China,Integrated,,Shandong Jintwang,"Shuyuan, Qufu, Jining, Shandong",Operating,35.631182200000005,117.00707290000001,GCD,Approximate,,,,,,,,,1 Dry - 1.5Mt/yr,1.0,DRY,,,1.5,Mt/yr,,+86-537-4612116,+86-537-4612116
CHN,CHN0598,China,Grinding,Huaian Plant,Shandong LiuYan (Votorantim),Jiangsu,Operating,33.0000001,119.9999999,GCD,Approximate,,,,,,,,,1.2Mt/yr,,,,,1.2,Mt/yr,,,
CHN,CHN0599,China,Integrated,,Shandong Qiyin Cement Group,"No.419 Niushan Road, Linzi, Zibo, Shandong",Operating,36.794167,118.325278,GCD,Approximate,,,,,,,,,7 Dry - 1.50Mt/yr,7.0,DRY,,,1.5,Mt/yr,,+86-533-7179050,+86-533-7180549
CHN,CHN0602,China,Integrated,,Shandong Zibo Luzhong Cement,"South Korea Industrial Park, Zichuan, Zibo, Shandong",Operating,36.56274035,118.04208670000001,GCD,Approximate,,,,,,,,,1 Dry - 1.4Mt/yr,1.0,DRY,,,1.4,Mt/yr,,+86-533-5699999,+86-533-5686616
CHN,CHN0606,China,Integrated,Pudong Plant,Shanghai Building Material Group General Company,"No.1 Lane, 1406 Zhangjiang Road, Pudong New Area, Shanghai",Operating,31.2040528999999,121.61444440000001,GCD,Approximate,,,,,,,,,1 Dry - 0.47Mt/yr,1.0,DRY,,,0.47,Mt/yr,,+86-21-58551266,+86-21-58552006
CHN,CHN0607,China,Integrated,Shanghai Allied Cement,Shanghai Building Material Group General Company,"No.1388 Zhangdong Road, Pudong New Area, Shanghai",Operating,31.2217826,121.538740099999,GCD,Approximate,,,,,,,,,1 Dry - 0.62Mt/yr,1.0,DRY,,,0.62,Mt/yr,,+86-21-64325171,+86-21-64325050
CHN,CHN0608,China,Integrated,,Shanghai Building Material Group General Company,"Shanghai Wan’an Head Office, No.4338 Tingfeng Road, Jinshan, Shanghai",Operating,30.744816999999898,121.3372571,GCD,Approximate,,,,,,,,,1 Dry - 0.47Mt/yr,1.0,DRY,,,0.47,Mt/yr,,+86-21-57320710,+86-21-57321485
CHN,CHN0609,China,Integrated,,Shangluo Shangshan Group Cement,"Dongjiao, Shangluo, Shaanxi",Operating,33.8678555,109.9353876,GCD,Approximate,,,,,,,,,2 Shaft - 0.13Mt/yr,,,,,0.13,Mt/yr,,+86-914-2251808,+86-914-2251616
CHN,CHN0610,China,Integrated,Donggang Cement,Shangnan Qingdong Group,"Guojia, Dangma, Shangnan, Shangluo, Shaanxi",Operating,33.5337978999999,110.838232,GCD,Approximate,,,,,,,,,2 Shaft - 0.20Mt/yr,,,,,0.2,Mt/yr,,+86-914-6326088,+86-914-6368668
CHN,CHN0611,China,Integrated,,Shangzhou Beiliu Cement,"Yancun, Jinlingsi, Shangzhou, Shangluo, Shaanxi",Operating,33.8650047,109.9431124,GCD,Approximate,,,,,,,,,1 Shaft - 0.10Mt/yr,,,,,0.1,Mt/yr,,+86-914-2251809,+86-914-2251809
CHN,CHN0612,China,Integrated,,Shannan Xingye Cement,"No.30 Songzan Road, Zedang, Naidong, Shannan, Tibet",Operating,29.1728219,91.8161614,GCD,Approximate,,,,,,,,,1 Dry - 0.31Mt/yr,1.0,DRY,,,0.31,Mt/yr,,+86-893-7821266,+86-893-7824745
CHN,CHN0613,China,Integrated,,Shannan Yalong Cement,"No.24 Gongbu Road, Zedang, Naidong, Shannan, Tibet",Operating,29.1728219,91.8161614,GCD,Approximate,,,,,,,,,1 Shaft - 0.04Mt/yr,,,,,0.04,Mt/yr,,+86-893-7821506,+86-893-7821506
CHN,CHN0614,China,Integrated,,Shanxi Aluminium Manufacturer Jinshui Cement,"Qingjian Fourth, Hejin, Yuncheng, Shanxi",Operating,35.595776799999896,110.7057517,GCD,Approximate,,,,,,,,,1 Dry - 0.47Mt/yr,1.0,DRY,,,0.47,Mt/yr,,+86-359-5041707,+86-359-5042407
CHN,CHN0615,China,Integrated,,Shanxi Ankung Jianhuan Group Cement,"No.6 Jiangbei Road Ankang, Shaanxi",Operating,36.0,109.0,GCD,Approximate,,,,,,,,,2 Dry - 1.56Mt/yr,2.0,DRY,,,1.56,Mt/yr,,+86-915-3310519,+86-915-3311995
CHN,CHN0616,China,Grinding,Huangling Plant,Shanxi Biological Cement,HuangLing,Operating,35.5828559,109.25962890000001,GCD,Approximate,,,,,,,,,1Mt/y (Est) - Loesche Vertical Roller Mill,,,,,1.0,Mt/yr,,,
CHN,CHN0617,China,Integrated,,Shanxi Chuandong Cement,"Yiju, Tianjiahui, Lishi, Luliang, Shanxi",Operating,37.5262,111.20299999999901,GCD,Approximate,,,,,,,,,1 Dry - 0.47Mt/yr,1.0,DRY,,,0.47,Mt/yr,,+86-358-3384805,+86-358-3384806
CHN,CHN0618,China,Integrated,,Shanxi Hanzhong Jiaodong Cement,"Liangshan, Nanzheng, Hanzhong, Shaanxi",Operating,33.006823600000004,106.936631,GCD,Approximate,,,,,,,,,1 Dry - 0.78Mt/yr,1.0,DRY,,,0.78,Mt/yr,,+86-916-5392248,+86-916-5392248
CHN,CHN0619,China,Integrated,,Shanxi Liquan Cement,"Zhao, Liquan, Xianyang, Shaanxi",Operating,34.563923100000004,108.44854860000001,GCD,Approximate,,,,,,,,,2 Shaft - 0.16Mt/yr,,,,,0.16,Mt/yr,,+86-29-35850061,+86-29-35850076
CHN,CHN0621,China,Integrated,,Shanxi Pucheng Potou Cement,"Potou Street, Pucheng, Weinan, Shaanxi",Operating,34.9588442999999,109.593807199999,GCD,Approximate,,,,,,,,,1 Shaft - 0.10Mt/yr,,,,,0.1,Mt/yr,,+86-913-7414668,+86-913-7414668
CHN,CHN0622,China,Integrated,Tianji Group Cement,Shanxi Tianji Coal Chemical Industry Group,"Zhonghua East Street, Lucheng, Changzhi, Shanxi",Operating,36.3637096,113.2229376,GCD,Approximate,,,,,,,,,1 Dry - 0.31Mt/yr,1.0,DRY,,,0.31,Mt/yr,,+86-355-6898491,+86-355-6898491
CHN,CHN0623,China,Integrated,,Shanxi Weihe Cement,"Pucheng, Weinan, Shaanxi",Operating,34.9588442999999,109.593807199999,GCD,Approximate,,,,,,,,,1 Shaft - 0.10Mt/yr,,,,,0.1,Mt/yr,,+86-913-7258199,+86-913-7258199
CHN,CHN0628,China,Integrated,Cement,Shanxi Yaobai Special Cement,"Qinghe, Yongle, Zhen’an, Ankang, Shaanxi",Operating,32.7330178,108.9903977,GCD,Approximate,,,,,,,,,1 Dry - 0.47Mt/yr,1.0,DRY,,,0.47,Mt/yr,,Shangluo Yaobai Xiushan +86-914-5362501,+86-914-5362509
CHN,CHN0631,China,Integrated,,Shenhua Group Fugu Tianqiao Cement,"Heishan, Fugu, Fugu, Yulin, Shaanxi",Operating,39.031227,111.05810679999901,GCD,Approximate,,,,,,,,,1 Dry - 0.31Mt/yr,1.0,DRY,,,0.31,Mt/yr,,+86-912-8729103,+86-912-8729454
CHN,CHN0632,China,Integrated,,Shenmu Meijian Cement,"Qianliuta, Daliuta, Shenmu, Yulin, Shaanxi",Operating,39.2521706,110.2493035,GCD,Approximate,,,,,,,,,1 Dry - 0.31Mt/yr,1.0,DRY,,,0.31,Mt/yr,,+86-912-8412273,+86-912-8412273
CHN,CHN0633,China,Integrated,,Shihezi Nanshan Cement,"Shichang, Nanshan, Shihezi, Xinjiang",Operating,44.298891,86.0528380999999,GCD,Approximate,,,,,,,,,2 Shaft -  0.11Mt/yr,,,,,0.11,Mt/yr,,+86-993-5290100,+86-993-5290155
CHN,CHN0634,China,Integrated,,Shihezi Xinlan Cement Building Materials,"Shihong, Shihezi, Xinjiang",Operating,44.298891,86.0528380999999,GCD,Approximate,,,,,,,,,2 Dry - 2Mt/yr,2.0,DRY,,,2.0,Mt/yr,,+86-993-5198091,+86-993-5198256
CHN,CHN0635,China,Integrated,,Shuangyashan Xinshidai Cement,"Fulitun, Jixian, Shuangyashan, Kiamusze, Heilungkiang",Operating,46.722434,131.134314,GCD,Approximate,,,,,,,,,2 Dry - 1.62Mt/yr,2.0,DRY,,,1.62,Mt/yr,,+86-469-4319565,+86-469-4319577
CHN,CHN0636,China,Integrated,,Shule Yuda Cement,"Shisi, Baren, Shule, Kashi, Xinjiang",Operating,39.4049776,76.05105879999991,GCD,Approximate,,,,,,,,,1 Shaft - 0.10Mt/yr,,,,,0.1,Mt/yr,,+86-998-6526030,+86-998-6526188
CHN,CHN0637,China,Integrated,,Sichuan Anxian Fushan Cement,"Sangzao, Anxian, Jiangyou, Mianyang, Sichuan",Operating,31.7777135,104.73443,GCD,Approximate,,,,,,,,,2 Shaft - 0.23Mt/yr,,,,,0.23,Mt/yr,,+86-816-4631302,+86-816-4631302
CHN,CHN0638,China,Integrated,,Sichuan Chuanwei Group,"Dashaba, Dongyu, Nanjiang, Bazhong, Sichuan",Operating,32.3116,106.819854,GCD,Approximate,,,,,,,,,1 Dry - 0.78Mt/yr,1.0,DRY,,,0.78,Mt/yr,,+86-827-8233112,+86-827-8233117
CHN,CHN0641,China,Integrated,,Sichuan Deyang Bajiao Cement,"Jinshajiang Road, Bajiaojing, Jingyang, Deyang, Sichuan",Operating,31.1904127,104.41874870000001,GCD,Approximate,,,,,,,,,2 Shaft - 0.25Mt/yr,,,,,0.25,Mt/yr,,+86-838-2600378,+86-838-2600378
CHN,CHN0642,China,Integrated,,Sichuan Deyang Chuanxiong Building Materials,"Yufei Road, Dongbei, Mianzhu, Deyang, Sichuan",Operating,31.3554573999999,104.19925479999901,GCD,Approximate,,,,,,,,,1 Dry - 0.31Mt/yr,1.0,DRY,,,0.31,Mt/yr,,+86-838-6190376,+86-838-6190448
CHN,CHN0645,China,Integrated,,Sichuan Gaoyu Special Cement,"Yangchang, Yang’an, Qionglai, Chengdu, Sichuan",Operating,30.3997472,103.6996093,GCD,Approximate,,,,,,,,,3 Shaft - 0.35Mt/yr,,,,,0.35,Mt/yr,,+86-28-88751056,+86-28-88751008
CHN,CHN0648,China,Integrated,,Sichuan Gulin Tieqiao Cement,"Shaba, Gulin, Luzhou, Sichuan",Operating,27.9689221,105.9314131,GCD,Approximate,,,,,,,,,3 Shaft - 0.20Mt/yr,,,,,0.2,Mt/yr,,+86-830-7260349,+86-830-7260349
CHN,CHN0649,China,Integrated,,Sichuan Guoda Cement,"Jiechi, Hanzeng, Jiangyou, Sichuan",Operating,31.773208,104.602897,GCD,Approximate,,,,,,,,,2 Dry - 2.5Mt/yr,2.0,DRY,,,2.5,Mt/yr,,+86-816-6127777,+86-816-6127777
CHN,CHN0652,China,Integrated,,Sichuan Jiangyou Shenlong Cement Manufacture,"Xiaoxiba, Jiangyou, Mianyang, Sichuan",Operating,31.8952115,105.0024922,GCD,Approximate,,,,,,,,,2 Shaft - 0.15Mt/yr,,,,,0.15,Mt/yr,,+86-816-3751262,+86-816-3751258
CHN,CHN0655,China,Integrated,,Sichuan Liangzhong Jinqi Cement,"Xianyu, Qili, Langzhong, Sichuan",Operating,31.5866696999999,105.974310299999,GCD,Approximate,,,,,,,,,2 Shaft - 0.20Mt/yr,,,,,0.2,Mt/yr,,+86-817-6301988,+86-817-6302088
CHN,CHN0657,China,Integrated,Dazhou Cement,Sichuan Lisen Building Materials Group,"Dazhu, Dazhou, Sichuan",Operating,30.7396638999999,107.20801809999901,GCD,Approximate,,,,,,,,,1 Dry - 1.25Mt/yr,1.0,DRY,,,1.25,Mt/yr,,+86-818-6452888,+86-818-6452888
CHN,CHN0663,China,Integrated,,Sichuan Luzhou Tuojiang Cement,"Dalin, Shizhai, Jiangyang, Luzhou, Sichuan",Operating,28.928444,105.190041,GCD,Approximate,,,,,,,,,3 Shaft - 0.40Mt/yr,,,,,0.4,Mt/yr,,+86-830-3750111,+86-830-3750111
CHN,CHN0664,China,Integrated,,Sichuan Mianzhu Guilan Cement,"Gaoxing, Xiaode, Mianzhu, Deyang, Sichuan",Operating,31.2561238,104.2710633,GCD,Approximate,,,,,,,,,3 Shaft - 0.33Mt/yr,,,,,0.33,Mt/yr,,+86-838-6590359,+86-838-6591983
CHN,CHN0665,China,Integrated,,Sichuan Pengshan Dongsheng Cement,"Caishan Pengxi, Pengshan, Meishan, Sichuan",Operating,30.1981104,103.8717011,GCD,Approximate,,,,,,,,,1 Shaft - 0.12Mt/yr,,,,,0.12,Mt/yr,,+86-833-7632197,+86-833-7632197
CHN,CHN0666,China,Integrated,,Sichuan Quxian Yunfeng Cement,"Heli, Tianxing, Quxian, Dazhou, Sichuan",Operating,30.807918400000002,107.00887920000001,GCD,Approximate,,,,,,,,,2 Shaft - 0.20Mt/yr,,,,,0.2,Mt/yr,,+86-818-7344021,+86-818-7344797
CHN,CHN0667,China,Integrated,,Sichuan Renshou Xianming Cement,"Xiaogou Renshou, Sichuan",Operating,30.500000099999898,102.4999999,GCD,Approximate,,,,,,,,,2 Shaft - 0.26Mt/yr,,,,,0.26,Mt/yr,,+86-838-6589016,+86-838-6589001
CHN,CHN0668,China,Integrated,,Sichuan Tianquan Tianlong Cement,"Meicen, Tianquan, Ya’an, Sichuan",Operating,30.0861909999999,102.592641,GCD,Approximate,,,,,,,,,2 Shaft - 0.20Mt/yr,,,,,0.2,Mt/yr,,+86-835-7228906,+86-835-7228906
CHN,CHN0669,China,Integrated,,Sichuan Tianying Cement,"Qiuxi, Zizhong, Neijiang, Sichuan",Operating,29.9690124,104.5257564,GCD,Approximate,,,,,,,,,3 Shaft - 0.30Mt/yr,,,,,0.3,Mt/yr,,+86-832-5822063,+86-832-5822063
CHN,CHN0670,China,Integrated,,Sichuan Wangcang Jinqi Cement Industrial,"Jinxi, Wangcang, Guangyuan, Sichuan",Operating,32.287226000000004,106.657977,GCD,Approximate,,,,,,,,,2 Shaft - 0.20Mt/yr,,,,,0.2,Mt/yr,,+86-839-4885058,+86-839-4885058
CHN,CHN0671,China,Integrated,,Sichuan Xinte Cement,"Dengguan, Yantan, Zigong, Sichuan",Operating,29.1563986999999,104.9333456,GCD,Approximate,,,,,,,,,3 Shaft - 0.30Mt/yr,,,,,0.3,Mt/yr,,+86-813-3900247,+86-813-3900247
CHN,CHN0672,China,Integrated,,Sichuan Yanyuan Jinguan Cement,"No.706 Yandong Street, Yanyuan, Liangshan, Sichuan",Operating,27.6307777,101.4481497,GCD,Approximate,,,,,,,,,1 Dry - 0.78Mt/yr,1.0,DRY,,,0.78,Mt/yr,,+86-834-6365895,+86-834-6365895
CHN,CHN0673,China,Integrated,,Sichuan Yibin Hengchang Building Materials,"Minxing Village, Tonggu, Changning, Yibin, Sichuan",Operating,28.582562100000004,104.91874890000001,GCD,Approximate,,,,,,,,,2 Shaft - 0.15Mt/yr,,,,,0.15,Mt/yr,,+86-831-4550205,+86-831-4550010
CHN,CHN0674,China,Integrated,Baita Subsidiary,Sichuan Yingshan Fengfa Cement,"Baita Road, Yingshan, Dazhou, Sichuan",Operating,31.216036,107.5027564,GCD,Approximate,,,,,,,,,2 Shaft - 0.14Mt/yr,,,,,0.14,Mt/yr,,+86-818-7480118,+86-818-7480098
CHN,CHN0675,China,Integrated,,Sichuan Yuanwei Cement,"Puziwan, Weiyuan, Neijiang, Sichuan",Operating,29.592493,104.602604,GCD,Approximate,,,,,,,,,1 Dry - 1Mt/yr,1.0,DRY,,,1.0,Mt/yr,,+86-832-8947998,+86-832-8947998
