iso3,uid,country,plant_type,gcd_plant_name,gcd_company_name,gcd_location,status,latitude,longitude,source,accuracy,permid,company_name,reported_capacity,reported_online_modernisation,owner_source,date_accessed,parent_permid,parent_name,desc,num_kilns_1,kiln_type_1,num_kilns_2,kiln_type_2,capacity,capacity_unit,contact,tel,fax
CHN,CHN0296,China,Integrated,,Guizhou Weng’an Yushan Cement,"Yushan, Weng’an, Qiannan, Guizhou",Operating,27.2206,107.338,GCD,Approximate,,,,,,,,,2 Shaft - 0.19Mt/yr,,,,,0.19,Mt/yr,,+86-854-2911088,+86-854-2911088
CHN,CHN0297,China,Integrated,,Hainan Bayi Cement,"Bayi Farm, Danzhou, Hainan",Operating,19.6574654,109.24422140000001,GCD,Approximate,,,,,,,,,2 Shaft - 0.20Mt/yr,,,,,0.2,Mt/yr,,+86-898-23761608,+86-898-23761536
CHN,CHN0298,China,Integrated,,Hainan Bayi Jinling Cement,"Bayi Farm, Danzhou, Hainan",Operating,19.6574654,109.24422140000001,GCD,Approximate,,,,,,,,,3 Shaft - 0.30Mt/yr,,,,,0.3,Mt/yr,,+86-898-23768170,+86-898-23764866
CHN,CHN0299,China,Integrated,,Hainan Tongshi Dajiangnan Cement,"Maoyang, Wuzhishan, Hainan",Operating,18.9406237,109.52812320000001,GCD,Approximate,,,,,,,,,2 Shaft - 0.10Mt/yr,,,,,0.1,Mt/yr,,+86-898-86726158,+86-898-86726189
CHN,CHN0300,China,Grinding,Hainan Plant,Hainan Wuzhishan Dajiangnan Cement,"Maoyang, Wuzhishan, Hainan",Operating,18.9406237,109.52812320000001,GCD,Approximate,,,,,,,,,0.6Mt/yr,,,,,0.6,Mt/yr,,,
CHN,CHN0301,China,Integrated,,Hancheng Qiyuan Building Materials,"Goubei Road, Xizhuang, Hancheng, Shaanxi",Operating,35.4762518999999,110.45080290000001,GCD,Approximate,,,,,,,,,1 Shaft - 0.10Mt/yr,,,,,0.1,Mt/yr,,+86-913-5293336,+86-913-5293337
CHN,CHN0302,China,Integrated,,Hangzhou Hucheng Cement,"Shujia, Lijia, Jiande, Hangzhou, Zhejiang",Operating,29.3286533999999,119.0326541,GCD,Approximate,,,,,,,,,1 Dry - 0.94Mt/yr,1.0,DRY,,,0.94,Mt/yr,,+86-575-64591108,+86-575-64591108
CHN,CHN0303,China,Integrated,,Hanjiang Yangchun Building Materials,"Yangchunqiao, Nanzheng, Hanzhong, Shaanxi",Operating,33.006823600000004,106.936631,GCD,Approximate,,,,,,,,,2 Shaft - 0.20Mt/yr,,,,,0.2,Mt/yr,,+86-916-5527187,+86-916-5527187
CHN,CHN0304,China,Integrated,,Hanyin Hanyuan Building Materials,"Yuehe, Chengguan, Hanyin, Ankang, Shaanxi",Operating,32.8856282,108.50313510000001,GCD,Approximate,,,,,,,,,2 Shaft - 0.15Mt/yr,,,,,0.15,Mt/yr,,+86-915-5271377,+86-915-5216053
CHN,CHN0305,China,Integrated,,Harbin Honggu Cement Plant Qiqihar Subsidiary,"No.32 Nanshu Road, Tiefeng, Qiqihar, Heilungkiang",Operating,47.295922999999995,124.225526,GCD,Approximate,,,,,,,,,1 Dry - 0.31Mt/yr,1.0,DRY,,,0.31,Mt/yr,,+86-452-2539666,+86-452-2539666
CHN,CHN0306,China,Integrated,,Harbin Quanxing Cement,"No.278 South Street, Yuquan, Acheng, Harbin,",Operating,45.413422,127.16478000000001,GCD,Approximate,,,,,,,,,1 Dry - 0.40Mt/yr,1.0,DRY,,,0.4,Mt/yr,,+86-451-53849170,+86-451-53847014
CHN,CHN0310,China,Integrated,,Hebei Yehe Cement,"Pinghsan, Industrial Park, Shijiazhuang, Hebei",Operating,38.04,114.47,GCD,Approximate,,,,,,,,,1 Dry - 0.31Mt/yr,1.0,DRY,,,0.31,Mt/yr,,+86-311-82801082,+86-311-82801082
CHN,CHN0311,China,Integrated,,Hebukesair Xueshan Cement,"Heshituoluogai, Hefeng, Tacheng, Xinjiang",Operating,46.7468826,82.9797318,GCD,Approximate,,,,,,,,,1 Dry - 0.31Mt/yr,1.0,DRY,,,0.31,Mt/yr,,+86-990-6727258,+86-990-6727101
CHN,CHN0312,China,Integrated,,Hebukesair Yili te Beitun Building Materials,"Heshituoluogai, Hefeng, Tacheng, Xinjiang",Operating,46.7468826,82.9797318,GCD,Approximate,,,,,,,,,1 Dry - 0.31Mt/yr,1.0,DRY,,,0.31,Mt/yr,,+86-990-6728687,+86-990-6728788
CHN,CHN0313,China,Integrated,,Hechi Guangchi Cement,"Jianshe, Jinchengjiang, Jinchengjiang, Hechi, Guangxi",Operating,24.696569600000004,108.05237199999901,GCD,Approximate,,,,,,,,,3 Shaft - 0.40Mt/yr,,,,,0.4,Mt/yr,,+86-778-2106010,+86-778-2105061
CHN,CHN0314,China,Integrated,,Hechuan Duhui Cement Manufacture,"Wufenggou, Didian Town, Heyang, Weinan, Shaanxi",Operating,35.235757,110.140793099999,GCD,Approximate,,,,,,,,,1 Shaft - 0.11Mt/yr,,,,,0.11,Mt/yr,,+86-913-5750283,+86-913-5750283
CHN,CHN0315,China,Integrated,,Heihe Hengji Cement,"Xinxing Base Material Processing Zone Collaboration Area, Heihe, Heilungkiang",Operating,49.3572,129.00898700000002,GCD,Approximate,,,,,,,,,1 Dry - 0.37Mt/yr,1.0,Dry,,,0.37,Mt/yr,,-16512370,
CHN,CHN0317,China,Integrated,,Heilungkiang Huanan Xinglong Cement,"Jiaotong Street, Huanan, Kiamusze, Heilungkiang",Operating,46.798913,130.315703,GCD,Approximate,,,,,,,,,1 Dry - 0.31Mt/yr,1.0,DRY,,,0.31,Mt/yr,,+86-454-6222306,+86-454-6222821
CHN,CHN0318,China,Integrated,,Heilungkiang Xiaoling Cement,"Xiaoling, Achengt, Harbin, Heilungkiang",Operating,45.335437,127.307732,GCD,Approximate,,,,,,,,,1 Dry - 0.37Mt/yr,1.0,DRY,,,0.37,Mt/yr,,+86-451-53815339,+86-451-53815339
CHN,CHN0319,China,Integrated,,Heishan County Changhe Cement,"No.3 Kuangguang Road, Badaohao, Heishan, Jinzhou, Liaoning",Operating,41.817801,121.9864364,GCD,Approximate,,,,,,,,,1 Dry - 0.47Mt/yr,1.0,DRY,,,0.47,Mt/yr,,+86-416-5951536,+86-416-5951536
CHN,CHN0320,China,Integrated,,Henan Anyang Yimin Cement,"Hexi, Xujiagou, Anyang, Anyang, Henan",Operating,36.10235520000001,114.33633,GCD,Approximate,,,,,,,,,3 Shaft - 0.30Mt/yr,,,,,0.3,Mt/yr,,+86-372-5812160,+86-372-5812160
CHN,CHN0323,China,Integrated,,Henan Nanyang Hangtian Cement,"Pushan, Wolong, Nanyang, Henan",Operating,33.119945,112.592077,GCD,Approximate,,,,,,,,,2 Dry - 1.87Mt/yr,2.0,DRY,,,1.87,Mt/yr,,+86-377-2052360,+86-377-2052399
CHN,CHN0328,China,Integrated,,Henan Xiaoshan Cement Group,"Houya, Zhangmao, Shan, Sanmenxia, Henan",Operating,34.692778000000004,111.39861100000002,GCD,Approximate,,,,,,,,,2 Dry - 1.72Mt/yr,2.0,DRY,,,1.72,Mt/yr,,+86-398-3411075,+86-398-3411075
CHN,CHN0329,China,Integrated,,Henan Xinshiji Xinfeng Cement,"Gongnong West Street, Jishui, Weihui, Xinxiang, Henan",Operating,35.4126425,114.0633095,GCD,Approximate,,,,,,,,,1 Dry - 0.78Mt/yr,1.0,DRY,,,0.78,Mt/yr,,+86-373-4415228,+86-373-4415140
CHN,CHN0330,China,Integrated,,Henan Yanshi Cement Plant,"Zhuge, Zhuge, Yanshi, Luoyang, Henan",Operating,34.7309816,112.7769607,GCD,Approximate,,,,,,,,,1 Dry - 0.78Mt/yr,1.0,DRY,,,0.78,Mt/yr,,+86-379-7418175,+86-379-7418175
CHN,CHN0331,China,Integrated,,Henan Yunan Cement,"No.1 Quezheng Road, Queshan, Zhumadian, Henan",Operating,32.8035886,114.020005,GCD,Approximate,,,,,,,,,1 Dry - 0.78Mt/yr,1.0,DRY,,,0.78,Mt/yr,,+86-396-7060089,+86-396-7060311
CHN,CHN0333,China,Integrated,,Hengyang Xiangjiang Cement Industrial,"No.58 Xingfu Road, Zhengxiang, Hengyang, Hunan",Operating,26.88444255,112.5529242,GCD,Approximate,,,,,,,,,2 Dry - 1.72Mt/yr,2.0,DRY,,,1.72,Mt/yr,,+86-734-8270116,+86-734-8270116
CHN,CHN0335,China,Integrated,,Honghe Ziyan Cement,"Dongcun, Chenguan, Jianshui, Honghe, Yunnan",Operating,23.636260399999898,102.8263741,GCD,Approximate,,,,,,,,,2 Shaft - 0.16Mt/yr,,,,,0.16,Mt/yr,,+86-873-7694033,+86-873-7694035
CHN,CHN0343,China,Integrated,,Huaping Gaoyuan Building Materials,"Daixng, Huaping, Lijiang, Yunnan",Operating,26.6318810999999,101.26289820000001,GCD,Approximate,,,,,,,,,2 Dry - 0.50Mt/yr,2.0,DRY,,,0.5,Mt/yr,,+86-888-6451039,+86-888-6451386
CHN,CHN0344,China,Integrated,,Huating Longdong Building Materials Group,"Cedi, Huating, Pingliang, Gansu",Operating,35.310053700000005,106.603154,GCD,Approximate,,,,,,,,,1 Dry - 0.31Mt/yr,1.0,DRY,,,0.31,Mt/yr,,+86-933-7820001,+86-933-7820001
CHN,CHN0345,China,Integrated,,Huaxin Cement (41.9% LafargeHolcim),"Beizha, Zhaoyang, Zhaotong, Yunnan",Operating,27.38327775,103.700038,GCD,Approximate,,,,,,,,,1 Dry - 1.25Mt/yr,1.0,DRY,,,1.25,Mt/yr,,+86-870-2838848,+86-870-2838848
CHN,CHN0348,China,Integrated,,Huaxin Cement (41.9% LafargeHolcim),"Guojiaba, Guojiaba, Zigui, Yichang, Hubei",Operating,30.8253169,110.969372099999,GCD,Approximate,,,,,,,,,1 Dry - 1.25Mt/yr,1.0,DRY,,,1.25,Mt/yr,,+86-717-2672001,+86-717-2672001
CHN,CHN0351,China,Integrated,,Huaxin Cement (41.9% LafargeHolcim),"No.1 Huaxing Road, Wuxue, Hubei",Operating,30.019492,115.621347,GCD,Approximate,,,,,,,,,2 Dry - 3.37Mt/yr,2.0,DRY,,,3.37,Mt/yr,,+86-713-6549168,+86-713-6549168
CHN,CHN0356,China,Integrated,,Huaying Yongyi Cement,"Yucao, Xikou, Huaying, Guang’an, Sichuan",Operating,30.3843078,106.775599,GCD,Approximate,,,,,,,,,2 Shaft - 0.16Mt/yr,,,,,0.16,Mt/yr,,+86-826-4664675,+86-826-4661238
CHN,CHN0358,China,Integrated,,Hubei Huayang Cement,"No.24 Huaxiang Industrial Park, Huarong, Ezhou, Hubei",Operating,30.5347436999999,114.7278378,GCD,Approximate,,,,,,,,,3 Dry - 5Mt/yr,3.0,DRY,,,5.0,Mt/yr,,+86-711-3257175,+86-711-3566906
CHN,CHN0359,China,Integrated,Jinglan Cement,Hubei Jinglan Group,"Qianyang, Jingshan, Jingmen, Hubei",Operating,31.1372308,113.124384599999,GCD,Approximate,,,,,,,,,1 Dry - 0.62Mt/yr,1.0,DRY,,,0.62,Mt/yr,,+86-724-7539099,+86-724-7539088
CHN,CHN0362,China,Integrated,,Hubei Wudang Cement,"Hongmiao, Chengguan, Yunxi, Shiyan, Hubei",Operating,33.0009728,110.17886920000001,GCD,Approximate,,,,,,,,,1 Dry - 0.94Mt/yr,1.0,DRY,,,0.94,Mt/yr,,+86-719-6205368,+86-719-6205368
CHN,CHN0363,China,Integrated,,Hubei Zhuxi Ruicheng Cement,"Shuiping, Zhuxi, Shiyan, Hubei",Operating,32.3034932,109.81321570000001,GCD,Approximate,,,,,,,,,1 Dry - 0.78Mt/yr,1.0,DRY,,,0.78,Mt/yr,,+86-719-2705999,+86-719-2705999
CHN,CHN0364,China,Integrated,,Huiyang Shuangxin Cement,"Tangxia Industrial Park, Xinyu, Huiyang, Guangdong",Operating,22.7889017,114.4717876,GCD,Approximate,,,,,,,,,1 Dry - 0.31Mt/yr,1.0,DRY,,,0.31,Mt/yr,,+86-752-3336251,+86-752-3336408
CHN,CHN0366,China,Integrated,,Hunan Shimen Qiangsheng Cement,"No.58 Shuangqiao Road, Xinguan, Shimen, Changde, Hunan",Operating,29.616689,111.30732900000001,GCD,Approximate,,,,,,,,,1 Dry - 0.31Mt/yr,1.0,DRY,,,0.31,Mt/yr,,+86-736-5352387,+86-736-5352382
CHN,CHN0368,China,Integrated,,Hunan Xiangwei,"Dajiangkou, Xupu, Huaihua, Hunan",Operating,27.7905159999999,110.632213,GCD,Approximate,,,,,,,,,1 Dry - 0.37Mt/yr,1.0,DRY,,,0.37,Mt/yr,,+86-745-3587198,+86-745-3587722
CHN,CHN0369,China,Integrated,,Hunan Yinshan Industrial Group,"Yinshan, Changsha, Changsha, Hunan",Operating,28.187490000000004,112.98358229999901,GCD,Approximate,,,,,,,,,5 Dry - 8Mt/yr,5.0,DRY,,,8.0,Mt/yr,,+86-731-6266689,+86-731-6266689
CHN,CHN0372,China,Integrated,,Huocheng Sanshui Cement,"No.10 Chang’an Road, Qingshui, Huocheng, Yili, Xinjiang",Operating,44.1841166,80.7398542999999,GCD,Approximate,,,,,,,,,2 Shaft - 0.15Mt/yr,,,,,0.15,Mt/yr,,+86-999-3293888,+86-999-3293888
CHN,CHN0373,China,Integrated,,Huzhou Ansheng,"Ancheng, Dipu, Anji, Huzhou, Zhejiang",Operating,30.6383107,119.6755006,GCD,Approximate,,,,,,,,,1 Dry - 0.62Mt/yr,1.0,DRY,,,0.62,Mt/yr,,+86-572-5108088,+86-572-5108087
CHN,CHN0376,China,Integrated,,Inner Mongolia Linxi Town Yiwande Industry,"North Street, Linxi, Linxi, Chifeng, Inner Mongolia",Operating,43.6034087,118.0433273,GCD,Approximate,,,,,,,,,1 Dry - 0.47Mt/yr,1.0,DRY,,,0.47,Mt/yr,,+86-476-5430221,+86-476-5430221
CHN,CHN0381,China,Integrated,Yakeshi Mengxi Cement,Inner Mongolia Mengxi Cement,"Sangehe Wunur, Yakeshi, Inner Mongolia",Operating,49.285437,120.72830790000002,GCD,Approximate,,,,,,,,,1 Dry - 0.47Mt/yr,1.0,DRY,,,0.47,Mt/yr,,+86-470-2286699,+86-470-2286699
CHN,CHN0383,China,Integrated,,Inner Mongolia Xishui Strong Year,"Xizhuozi Haibowan, Wuhai, Inner Mongolia",Operating,39.6733094,106.81863190000001,GCD,Approximate,,,,,,,,,1 Dry - 1.56Mt/yr,1.0,DRY,,,1.56,Mt/yr,,+86-473-4661678,+86-473-4661202
CHN,CHN0388,China,Integrated,,Jiangsu Far East Cement,"Biancheng, Jurong, Zhenjiang, Jiangsu",Operating,32.055348800000004,119.30041969999901,GCD,Approximate,,,,,,,,,1 Dry - 0.78Mt/yr,1.0,DRY,,,0.78,Mt/yr,,+86-511-87181121,+86-511-87181182
CHN,CHN0389,China,Integrated,,Jiangsu Henglai Building Materials,"Xizhuang, Yangxiang, Yixing, Wuxi, Jiangsu",Operating,31.4749148999999,119.58751389999901,GCD,Approximate,,,,,,,,,2 Dry - 2.34Mt/yr,2.0,DRY,,,2.34,Mt/yr,,+86-510-87274692,+86-510-87271168
CHN,CHN0393,China,Grinding,Jiangxi Fuzhou Plant,Jiangxi Fuzhou South,"Fuzhou, Jiangxi",Operating,27.9957951,116.353245,GCD,Approximate,,,,,,,,,1Mt/yr,,,,,1.0,Mt/yr,,,
CHN,CHN0394,China,Grinding,Jiangxi Jishui Plant,Jiangxi Jishui South Cement Company,"Jishui County, Jiangxi",Operating,27.19785515,115.2255115,GCD,Approximate,,,,,,,,,1Mt/yr,,,,,1.0,Mt/yr,,Tel: +86 551 634 39080,
CHN,CHN0395,China,Integrated,,Jiangxi Sanhuan Cement,"Putting, Industrial Park Dean, Jiujiang, Jiangxi",Operating,29.3314081,115.758803499999,GCD,Approximate,,,,,,,,,1 Dry - 0.78Mt/yr,1.0,DRY,,,0.78,Mt/yr,,+86-792-4666088,+86-792-4666282
CHN,CHN0396,China,Integrated,,Jiangxi Shengta Industrial Group,"Zhongduan Industrial Park, Xinfeng, Ganzhou, Jiangxi",Operating,25.278423,114.972072,GCD,Approximate,,,,,,,,,2 Dry - 1.72Mt/yr,2.0,DRY,,,1.72,Mt/yr,,+86-797-3283599,+86-797-3281525
CHN,CHN0398,China,Integrated,,Jiangxi Tianfeng Building Materials,"Huangyuan Fenglingtou, Shangrao, Shangrao, Jiangxi",Operating,28.4531644,117.903535,GCD,Approximate,,,,,,,,,1 Dry - 0.37Mt/yr,1.0,DRY,,,0.37,Mt/yr,,+86-793-8492220,+86-793-8492988
CHN,CHN0402,China,Integrated,Cement,Jiangxi Wannianqing Cement,"Yanrui, Yushan, Shangrao, Jiangxi",Operating,28.753638,118.327528,GCD,Approximate,,,,,,,,,2 Dry - 1.56Mt/yr,2.0,DRY,,,1.56,Mt/yr,,Jiangxi Yushan Wannianqing +86-793-2366500,+86-793-2366500
CHN,CHN0404,China,Integrated,,Jiangxi Yutu Cement,"Chengxi Industrial Park, Xinyu, Jiangxi",Operating,27.8037001,114.9329419,GCD,Approximate,,,,,,,,,1 Dry - 0.94Mt/yr,1.0,DRY,,,0.94,Mt/yr,,+86-790-6310978,+86-790-6313188
CHN,CHN0405,China,Integrated,,Jiaoling Longteng Rotary Cement,"Youkeng, Xinpu, Jiaoling, Meizhou, Guangdong",Operating,24.64409365,116.169456199999,GCD,Approximate,,,,,,,,,1 Dry - 0.31Mt/yr,1.0,DRY,,,0.31,Mt/yr,,+86-753-7798488,+86-753-7798488
CHN,CHN0417,China,Integrated,,Jilin Dequan Cement Group Wangqing,"Miaoling, Daxinggou, Wangqing, Yanbian, Jilin",Operating,43.41119260000001,129.6552384,GCD,Approximate,,,,,,,,,2 Dry - 2.5Mt/yr,2.0,DRY,,,2.5,Mt/yr,,+86-433-8402857,+86-433-8402857
CHN,CHN0419,China,Integrated,,Jilin Shiling Cement,"Shiling Town, Lishu, Siping, Jilin",Operating,43.30548870000001,124.3249351,GCD,Approximate,,,,,,,,,1 Dry - 0.40Mt/yr,1.0,DRY,,,0.4,Mt/yr,,+86-434-5463337,+86-434-5464222
CHN,CHN0423,China,Integrated,Yarai Group Tumen Cement,Jilin Yatai Group,"Changan, Tumen, Jilin",Operating,43.021035,129.735161,GCD,Approximate,,,,,,,,,2 Dry - 2.81Mt/yr,2.0,DRY,,,2.81,Mt/yr,,+86-433-3650545,+86-433-3650545
CHN,CHN0429,China,Integrated,,Jinchang Jinni Group Cement,"Hexipu, Yongchang, Jinchang, Gansu",Operating,38.2446955,101.9710908,GCD,Approximate,,,,,,,,,1 Dry - 0.62Mt/yr,1.0,DRY,,,0.62,Mt/yr,,+86-935-7330725,+86-935-7330808
CHN,CHN0430,China,Integrated,,Jinfeng Building Materials,"Xiaoputou, Xiangfeng, Laifeng, Enshi, Hubei",Operating,29.507613,109.402662,GCD,Approximate,,,,,,,,,1 Dry - 0.47Mt/yr,1.0,DRY,,,0.47,Mt/yr,,+86-718-6276484,+86-718-6276484
CHN,CHN0431,China,Integrated,,Jingtai Xingquan Cement,"Xingquan, Xiquan, Jingtai, Baiyin, Gansu",Operating,37.0788122,104.0263708,GCD,Approximate,,,,,,,,,1 Dry - 0.31Mt/yr,1.0,DRY,,,0.31,Mt/yr,,+86-943-5562019,+86-943-5562019
CHN,CHN0432,China,Integrated,Shanxi Jinpai Cement Group,Jinshui Group,"Lucheng, Changzhi, Shanxi",Operating,36.3637096,113.2229376,GCD,Approximate,,,,,,,,,1 Dry - 1.5Mt/yr,1.0,DRY,,,1.5,Mt/yr,,+86-355-6768406,+86-355-6768413
CHN,CHN0436,China,Integrated,,Jiujiang Lanfeng Cement,"Maodian Longcheng, Hukou, Jiujiang, Jiangxi",Operating,29.7332458,116.2473706,GCD,Approximate,,,,,,,,,2 Dry - 1.56Mt/yr,2.0,DRY,,,1.56,Mt/yr,,+86-792-5682887,+86-792-5682887
CHN,CHN0438,China,Integrated,,Jiuzhaigou Cement,"Chaoyang, Shuanghe, Jiuzhaigou, Aba, Sichuan",Operating,33.1733039999999,104.25403399999901,GCD,Approximate,,,,,,,,,2 Shaft - 0.15Mt/yr,,,,,0.15,Mt/yr,,+86-837-7711188,+86-837-7711188
CHN,CHN0439,China,Integrated,,Jixi Sailong Cement Manufacture,"Ertaipu Chengzihe, Jixi, Heilungkiang",Operating,45.338725,131.00991000000002,GCD,Approximate,,,,,,,,,2 Dry - 0.62Mt/yr,2.0,DRY,,,0.62,Mt/yr,,+86-467-2412222,+86-467-2412016
CHN,CHN0443,China,Integrated,,Kunming Anning Guangming Cement,"Tangfang, Taiping, Anning, Kunming, Yunnan",Operating,24.9517922,102.58072469999901,GCD,Approximate,,,,,,,,,3 Shaft - 0.26Mt/yr,,,,,0.26,Mt/yr,,+86-871-8614328,+86-871-8614368
CHN,CHN0444,China,Integrated,,Kunming Dianbei Building Materials,"Dongchuan, Kunming, Yunnan",Operating,26.0861203,103.1849656,GCD,Approximate,,,,,,,,,1 Shaft - 0.12Mt/yr,,,,,0.12,Mt/yr,,+86-871-2422149,+86-871-2422150
CHN,CHN0445,China,Integrated,,Kunming Hongli Cement,"Beigucheng, Yiliang, Kunming, Yunnan",Operating,24.9718,103.185,GCD,Approximate,,,,,,,,,2 Shaft - 0.15Mt/yr,,,,,0.15,Mt/yr,,+86-871-7524435,+86-871-7524435
CHN,CHN0446,China,Integrated,,Kunming Liyu Building Materials,"Shijiangjun, Shangsuan, Jinning, Kunming, Yunnan",Operating,24.684404,102.6883397,GCD,Approximate,,,,,,,,,5 Shaft - 0.50Mt/yr,,,,,0.5,Mt/yr,,+86-871-7812047,+86-871-7812047
CHN,CHN0450,China,Integrated,,Lafarge Shui On Cement (LafargeHocim),"Dingxiao, Xingyi, Guizhou",Operating,25.1601112,105.00191650000001,GCD,Approximate,,,,,,,,,1 Dry - 0.31Mt/yr,1.0,DRY,,,0.31,Mt/yr,,+86-859-3523061,+86-859-3523021
CHN,CHN0452,China,Integrated,Shuangma Jiangyou Cement,Lafarge Shui On Cement (LafargeHocim),"Erlangmiao, Jiangyou, Sichuan",Operating,32.043484,105.090065,GCD,Approximate,,,,,,,,,1 Dry - 0.47Mt/yr,1.0,DRY,,,0.47,Mt/yr,,+86-816-3724888,+86-816-3724888
CHN,CHN0456,China,Integrated,Yunnan Guozi Cement Jianchuan,Lafarge Shui On Cement (LafargeHocim),"Meiyuan Building Materials Industrial Park, Jianchuan, Dali, Yunnan",Operating,26.540060600000004,99.9045932,GCD,Approximate,,,,,,,,,2 Dry - 0.81Mt/yr,2.0,DRY,,,0.81,Mt/yr,,+86-872-4529488,+86-872-4529488
CHN,CHN0457,China,Integrated,Yunnan Guozi Cement,Lafarge Shui On Cement (LafargeHocim),"Kanglang, Dabanqiao, Quandu, Kunming, Yunnan",Operating,25.0437977,102.714338,GCD,Approximate,,,,,,,,,1 Dry - 1.25Mt/yr,1.0,DRY,,,1.25,Mt/yr,,+86-871-7395803,+86-871-7395999
CHN,CHN0458,China,Integrated,Yunnan Guozi Cement Kunming,Lafarge Shui On Cement (LafargeHocim),"No.1356 Chunyu Road, Xishan, Kunming, Yunnan",Operating,25.0411094,102.66495649999901,GCD,Approximate,,,,,,,,,1 Dry - 0.47Mt/yr,1.0,DRY,,,0.47,Mt/yr,,+86-871-7411067,+86-871-7411067
CHN,CHN0459,China,Integrated,,Lafarge Shui On Cement (LafargeHocim),"Mugang, Liuzhi Special Region, Liupanshui, Guizhou",Operating,26.5929637,104.8436372,GCD,Approximate,,,,,,,,,1 Dry - 0.78Mt/yr,1.0,DRY,,,0.78,Mt/yr,,+86-858-8120207,+86-858-8120244
CHN,CHN0460,China,Integrated,,Lafarge Shui On Cement (LafargeHocim),"No.40 Daqiao Road, Kaili, Guizhou",Operating,26.5884306999999,107.9762121,GCD,Approximate,,,,,,,,,1 Dry - 0.78Mt/yr,1.0,DRY,,,0.78,Mt/yr,,+86-855-8602573,+86-855-8602573
CHN,CHN0461,China,Integrated,Kunming Junfeng Cement,Lafarge Shui On Cement (LafargeHocim),"Pingshan, Chongde, Luquan, Kunming, Yunnan",Operating,25.497251300000002,102.509297099999,GCD,Approximate,,,,,,,,,1 Dry - 0.62Mt/yr,1.0,DRY,,,0.62,Mt/yr,,+86-871-8355918,+86-871-8355918
CHN,CHN0467,China,Integrated,,Lafarge Shui On Cement (LafargeHocim),"Xishui, Zunyi, Guizhou",Operating,27.700537800000003,107.1680585,GCD,Approximate,,,,,,,,,1 Dry - 0.31Mt/yr,1.0,DRY,,,0.31,Mt/yr,,+86-852-2611668,+86-852-2611668
CHN,CHN0468,China,Integrated,,Lafarge Shui On Cement (LafargeHocim),"Yingtaogou, Xinpu, Honghuagang, Zunyi, Guizhou",Operating,27.6737838999999,106.96081869999901,GCD,Approximate,,,,,,,,,1 Dry - 0.31Mt/yr,1.0,DRY,,,0.31,Mt/yr,,+86-852-8914138,+86-852-8914138
CHN,CHN0471,China,Integrated,Fuling Cement,Lafarge Shui On Cement (LafargeHolcim),"No.88 Wujiang Road, Fuling, Chongqing",Operating,29.660589,107.332003,GCD,Approximate,,,,,,,,,1 Dry - 0.31Mt/yr,1.0,DRY,,,0.31,Mt/yr,,Chongqing Lafarge Tenghui +86-23-72772170,+86-23-72302581
CHN,CHN0473,China,Integrated,,Langao Kaiyuan Building Materials,"Linhekou, Langao, Ankang, Shaanxi",Operating,32.2800711,108.972519099999,GCD,Approximate,,,,,,,,,1 Shaft - 0.10Mt/yr,,,,,0.1,Mt/yr,,+86-915-2621218,+86-915-2621218
CHN,CHN0474,China,Integrated,,Lanzhou Gancao Environmental Building Materials,"No.98 Gancaodian, Yuzhong, Lanzhou, Gansu",Operating,35.8007932999999,104.2878356,GCD,Approximate,,,,,,,,,1 Dry - 0.31Mt/yr,1.0,DRY,,,0.31,Mt/yr,,+86-931-5381108,+86-931-5381178
CHN,CHN0475,China,Integrated,,"Lanzhou, Datonghe Cement","Shawo, Yaojie, Honggu, Lanzhou, Gansu",Operating,36.4334888,102.8726292,GCD,Approximate,,,,,,,,,3 Dry - 1.80Mt/yr,3.0,DRY,,,1.8,Mt/yr,,+86-931-6316677,+86-931-6316666
CHN,CHN0476,China,Integrated,,Leshan Fuxiang Building Materials,"No.53 Nanling Street, Shawan, Leshan, Sichuan",Operating,29.419927,103.54188359999901,GCD,Approximate,,,,,,,,,1 Shaft - 0.12Mt/yr,,,,,0.12,Mt/yr,,+86-833-3441913,+86-833-3441913
CHN,CHN0477,China,Integrated,,Leshan Shawan Haitian Building Materials,"Nanling Shawan, Shawan, Leshan, Sichuan",Operating,29.419927,103.54188359999901,GCD,Approximate,,,,,,,,,1 Shaft - 0.12Mt/yr,,,,,0.12,Mt/yr,,+86-838-3444868,+86-838-3447057
CHN,CHN0478,China,Integrated,,Lhasa Yuanda Building Materials,"No.133 Beijing West Road, Lhasa, Tibet",Operating,29.6641913,91.05906,GCD,Approximate,,,,,,,,,2 Shaft - 0.13Mt/yr,,,,,0.13,Mt/yr,,+86-891-6822817,+86-891-6862241
CHN,CHN0479,China,Integrated,,Liangzhou Naituo Cement,"Naituo, Yuexi, Liangshan, Sichuan",Operating,28.583197811310896,102.49745749851101,GCD,Approximate,,,,,,,,,1 Dry - 0.78Mt/yr,1.0,DRY,,,0.78,Mt/yr,,+86-834-7545493,+86-834-7545266
CHN,CHN0480,China,Integrated,,Liaoning Bohai Cement Group,"No.28 Xinggong Street, Lianshan, Huludao, Liaoning",Operating,40.8997878999999,120.63225200000001,GCD,Approximate,,,,,,,,,1 Dry - 1.25Mt/yr,1.0,DRY,,,1.25,Mt/yr,,+86-429-4503010,+86-429-4503018
CHN,CHN0483,China,Integrated,,Liaoning Liaodong Cement Group,"Datai, Dengta, Liaoyang, Liaoning",Operating,41.4244866,123.3335139,GCD,Approximate,,,,,,,,,1 Dry - 1.25Mt/yr,1.0,DRY,,,1.25,Mt/yr,,+86-419-8155355,+86-419-8155355
CHN,CHN0486,China,Integrated,,Linjiang Hongda Cement,"Taixing, Jianguo Street, Linjiang, Baishan, Jilin",Operating,41.809248600000004,126.9128334,GCD,Approximate,,,,,,,,,1 Dry - 0.31Mt/yr,1.0,DRY,,,0.31,Mt/yr,,+86-439-5219375,+86-439-5219375
CHN,CHN0488,China,Integrated,,Longde Longfeng Cement,"No.1 Jiefang Road, Longde, Guyuan, Ningxia",Operating,35.613733700000004,106.1209325,GCD,Approximate,,,,,,,,,1 Shaft - 0.10Mt/yr,,,,,0.1,Mt/yr,,+86-954-6011896,+86-954-6011440
CHN,CHN0490,China,Integrated,,Longyuan Construction Anhui Cement,"Digang, Fanchang, Wuhu, Anhui",Operating,31.122708000000003,118.005792,GCD,Approximate,,,,,,,,,2 Dry - 2.34Mt/yr,2.0,DRY,,,2.34,Mt/yr,,+86-553-7319666,+86-553-7319666
CHN,CHN0491,China,Integrated,,Loudi Louxing Cement Manufacture,"Baishi Street, Louxing, Loudi, Hunan",Operating,27.722724600000003,111.9977439,GCD,Approximate,,,,,,,,,1 Dry - 1.25Mt/yr,1.0,DRY,,,1.25,Mt/yr,,+86-738-8781257,+86-738-8781264
CHN,CHN0492,China,Integrated,,Lueyang County Cement,"Queyang, Hanzhong, Shaanxi",Operating,33.082084,107.0308676,GCD,Approximate,,,,,,,,,3 Shaft - 0.25Mt/yr,,,,,0.25,Mt/yr,,+86-916-4961627,+86-916-4961530
CHN,CHN0493,China,Integrated,,Luliang Sanchahe Cement,"Xiaoluoyi, Sanchahe, Luliang, Qujing, Yunnan",Operating,25.053,103.771,GCD,Approximate,,,,,,,,,3 Shaft - 0.25Mt/yr,,,,,0.25,Mt/yr,,+86-874-6971379,+86-874-6971188
CHN,CHN0494,China,Integrated,,Luohe Fengyuan Cement,"Mengmiao, Yancheng, Luohe, Henan",Operating,33.6315,114.007,GCD,Approximate,,,,,,,,,2 Shaft - 0.18Mt/yr,,,,,0.18,Mt/yr,,+86-395-6938999,+86-395-6938999
CHN,CHN0495,China,Integrated,,Luoping Yuma Cement,"Zhangkoudong, Banqiao, Luoping, Qujing, Yunnan",Operating,24.9659505,104.49263690000001,GCD,Approximate,,,,,,,,,1 Shaft - 0.10Mt/yr,,,,,0.1,Mt/yr,,+86-874-8741499,+86-874-8741499
CHN,CHN0496,China,Integrated,,Luoyang Zhonghexiang Cement,"Liang, Zhuge, Luoyang, Henan",Operating,34.6556873,112.42096289999901,GCD,Approximate,,,,,,,,,1 Dry - 0.37Mt/yr,1.0,DRY,,,0.37,Mt/yr,,+86-379-7418230,+86-379-7418230
CHN,CHN0497,China,Integrated,,Luoyang Ziluoshan Cement,"Xiaodian, Ruyang, Luoyang, Henan",Operating,34.14963820000001,112.4632777,GCD,Approximate,,,,,,,,,1 Dry - 0.31Mt/yr,1.0,DRY,,,0.31,Mt/yr,,+86-379-8141010,+86-379-8141010
CHN,CHN0498,China,Integrated,,Luxi Building Materials Industrial,"Jiangtou, Zhongshu, Luxi, Honghe, Yunnan",Operating,24.535018,103.7639695,GCD,Approximate,,,,,,,,,2 Shaft - 0.20Mt/yr,,,,,0.2,Mt/yr,,+86-873-6624197,+86-873-6624197
CHN,CHN0500,China,Integrated,,Meixian Dongxing Cement,"Dongliangge, Qijia, Meixian, Baoji, Shaanxi",Operating,34.3645810999999,107.23321840000001,GCD,Approximate,,,,,,,,,1 Shaft - 0.10Mt/yr,,,,,0.1,Mt/yr,,+86-917-5676886,+86-917-5676728
CHN,CHN0501,China,Integrated,,Meixian Kaisheng Rotary Cement,"Yueyi, Baidu, Mei, Meizhou, Guangdong",Operating,24.4978707,116.1954842,GCD,Approximate,,,,,,,,,3 Dry - 1.50Mt/yr,3.0,DRY,,,1.5,Mt/yr,,+86-753-2678040,+86-753-2678205
CHN,CHN0502,China,Integrated,,Meixian Meiyan Rotary Cement,"Shugu, Yanyang, Mei, Meizhou, Guangdong",Operating,24.3053552,116.1177436,GCD,Approximate,,,,,,,,,1 Dry - 0.62Mt/yr,1.0,DRY,,,0.62,Mt/yr,,+86-753-2832986,+86-753-2832883
CHN,CHN0505,China,Integrated,,Mianzhu Panlong Huajian,"Aodong B Area, Gongxing Industrial Park, Mianzhu, Deyang, Sichuan",Operating,31.4560919999999,104.250575,GCD,Approximate,,,,,,,,,1 Dry - 0.78Mt/yr,1.0,DRY,,,0.78,Mt/yr,,+86-838-8393182,+86-838-8393190
CHN,CHN0510,China,Integrated,,Nanchong Chuanbei Cement,"Zhaojiagou, Yingxi, Shunqing, Nanchong, Sichuan",Operating,30.8763719999999,106.06321899999901,GCD,Approximate,,,,,,,,,2 Shaft - 0.20Mt/yr,,,,,0.2,Mt/yr,,+86-817-2462555,+86-817-2462555
CHN,CHN0511,China,Integrated,,Nandan Cement,"Jiaoyu Road, Chengguan, Nandan, Hechi, Guangxi",Operating,25.0318804,107.56947360000001,GCD,Approximate,,,,,,,,,2 Shaft - 0.20Mt/yr,,,,,0.2,Mt/yr,,+86-778-7232063,+86-778-7230307
CHN,CHN0512,China,Integrated,,Nanjiang Cement Group,"Yuejiahe, Xiaohe, Nanjiang, Bazhong, Sichuan",Operating,32.326078,106.81318700000001,GCD,Approximate,,,,,,,,,1 Shaft - 0.12Mt/yr,,,,,0.12,Mt/yr,,+86-827-8210111,+86-827-8210111
